{
  "contract": "otsec.authz/0.5",
  "kind": "node.quarantine_clear",
  "request_id": "req-20261026-0001",
  "on_behalf_of": {
    "type": "human",
    "id": "alice@site-a"
  },
  "policy_version": 3,
  "admin_signed": {
    "key_id": "ed25519-183d5080d1a2ef2b",
    "algorithm": "ed25519",
    "payload": "eyJmb3JtYXQiOiJvdHNlYy5hdXRoei5hZG1pbi1yZXF1ZXN0LzAuNCIsImtpbmQiOiJub2RlLnF1YXJhbnRpbmVfY2xlYXIiLCJwcmluY2lwYWwiOnsidHlwZSI6Imh1bWFuIiwiaWQiOiJhbGljZUBzaXRlLWEifSwiYWRtaW5fa2V5X2lkIjoiZWQyNTUxOS0xODNkNTA4MGQxYTJlZjJiIiwibm9kZV9pZCI6InNpdGUtYS1ub2RlLTEiLCJpbnN0YWxsX2tleV9pZCI6InNpdGUtYS1ub2RlLTEuY29sbGVjdG9yLWluc3RhbGwuMSIsIm5vbmNlIjoiQUFFQ0F3UUZCZ2NJQ1FvTERBME9EdyIsImlzc3VlZF9hdCI6IjIwMjYtMTAtMjZUMTQ6NTg6MDBaIiwiZXhwaXJlc19hdCI6IjIwMjYtMTAtMjZUMTU6MDg6MDBaIiwibm9kZV9xdWFyYW50aW5lX2NsZWFyIjp7ImFzc2V0X2lkIjoiMmI3ZDRlMTAtOGMzZi00YTViLTllMjEtN2M0ZjBkNmE4YjEzIiwibWFuaWZlc3Rfc2hhMjU2IjoiNDc0NjhkOGNhNWYzZWJiMDU4ZGM0NTJmMzY2OWE3ZWQ2NGM2OWI5NTNhMjAyOTQ4MDFiNzUxNDdmZDQzZjYzNiJ9fQ==",
    "signature": "tfP9PDxvBxpa8lN2U4kbnWG5Zv2J49jyLWQTG464dSI8MhFJlIeLnsT44PdBFFyQO1kLU+ia3u2/RiSM7722BQ=="
  }
}
