{
  "contract": "otsec.authz/0.1",
  "kind": "credential.install",
  "request_id": "req-20261024-0003",
  "on_behalf_of": {
    "type": "human",
    "id": "alice@site-a"
  },
  "policy_version": 3,
  "credential_install": {
    "ref": {
      "id": "cred_7f3k2m9q4x",
      "asset_id": "2b7d4e10-8c3f-4a5b-9e21-7c4f0d6a8b13",
      "node_id": "site-a-node-1",
      "endpoint_id": "port1-telnet",
      "transport": "telnet",
      "purpose": "collect-readonly",
      "access_level": "2AC",
      "downstream_security": "plaintext-unauthenticated",
      "plaintext_scope": "lab-only",
      "version": 2,
      "created_by": {
        "type": "human",
        "id": "alice@site-a"
      },
      "created_at": "2026-10-24T11:40:00Z"
    },
    "sealed": {
      "alg": "x25519-hkdf-sha256-aes256gcm",
      "recipient_key_id": "site-a-node-1.collector-install.1",
      "ephemeral_public_key": "BwcHBwcHBwcHBwcHBwcHBwcHBwcHBwcHBwcHBwcHBwc=",
      "nonce": "CQkJCQkJCQkJCQkJ",
      "ciphertext": "AwMDAwMDAwMDAwMDAwMDAwMDAwMDAwMDAwM="
    }
  }
}
