{
  "contract": "otsec.authz/0.7",
  "kind": "run",
  "request_id": "req-20261028-0001",
  "on_behalf_of": {
    "type": "schedule",
    "id": "sch-config-751-feeder-3"
  },
  "policy_version": 3,
  "run": {
    "asset_id": "2b7d4e10-8c3f-4a5b-9e21-7c4f0d6a8b13",
    "operation_id": "sel.config.read_all",
    "params": {},
    "credential_ref": "cred_7f3k2m9q4x",
    "register_version": 12
  }
}
