{
  "contract": "otsec.authz/0.7",
  "kind": "node.change_approval",
  "request_id": "req-20261026-0001",
  "on_behalf_of": {
    "type": "human",
    "id": "alice@site-a"
  },
  "policy_version": 3,
  "admin_signed": {
    "key_id": "ed25519-183d5080d1a2ef2b",
    "algorithm": "ed25519",
    "payload": "eyJmb3JtYXQiOiJvdHNlYy5hdXRoei5hZG1pbi1yZXF1ZXN0LzAuNCIsImtpbmQiOiJub2RlLmNoYW5nZV9hcHByb3ZhbCIsInByaW5jaXBhbCI6eyJ0eXBlIjoiaHVtYW4iLCJpZCI6ImFsaWNlQHNpdGUtYSJ9LCJhZG1pbl9rZXlfaWQiOiJlZDI1NTE5LTE4M2Q1MDgwZDFhMmVmMmIiLCJub2RlX2lkIjoic2l0ZS1hLW5vZGUtMSIsImluc3RhbGxfa2V5X2lkIjoic2l0ZS1hLW5vZGUtMS5jb2xsZWN0b3ItaW5zdGFsbC4xIiwibm9uY2UiOiJBQUVDQXdRRkJnY0lDUW9MREEwT0R3IiwiaXNzdWVkX2F0IjoiMjAyNi0xMC0yNlQxNDo1ODowMFoiLCJleHBpcmVzX2F0IjoiMjAyNi0xMC0yNlQxNTowODowMFoiLCJub2RlX2NoYW5nZV9hcHByb3ZhbCI6eyJhc3NldF9pZCI6IjJiN2Q0ZTEwLThjM2YtNGE1Yi05ZTIxLTdjNGYwZDZhOGIxMyIsImJhc2VsaW5lX2RpZ2VzdCI6InNoYTI1NjplZTFkNWNkMDRmY2VlN2ZkMzNjNjg0NTNiN2ZiNmE5ZWMxZjcxMjRiZjllODhiMDNmMWE0YmI2NjQwMzEwZTg5Iiwid2luZG93X3N0YXJ0IjoiMjAyNi0xMC0yNlQxNjowMDowMFoiLCJ3aW5kb3dfZW5kIjoiMjAyNi0xMC0yNlQyMDowMDowMFoiLCJyZWFzb24iOiJSZXBsYWNlIENUIHJhdGlvIGFmdGVyIHJlbGF5IHRlc3QgKHdvcmsgb3JkZXIgNDcxMSkifX0=",
    "signature": "XB3Jw+s/ABy41+FHqxw+gOlvHXzeO6ZnUA8h3SNWEU0uHI5oXP9o1mvMoNFrCS0RaM/w648Ps8858SgKVRwuCA=="
  }
}
