{
  "contract": "otsec.authz/0.4",
  "kind": "credential.install",
  "request_id": "req-20261026-0001",
  "on_behalf_of": {
    "type": "human",
    "id": "alice@site-a"
  },
  "policy_version": 3,
  "admin_signed": {
    "key_id": "ed25519-183d5080d1a2ef2b",
    "algorithm": "ed25519",
    "payload": "eyJmb3JtYXQiOiJvdHNlYy5hdXRoei5hZG1pbi1yZXF1ZXN0LzAuNCIsImtpbmQiOiJjcmVkZW50aWFsLmluc3RhbGwiLCJwcmluY2lwYWwiOnsidHlwZSI6Imh1bWFuIiwiaWQiOiJhbGljZUBzaXRlLWEifSwiYWRtaW5fa2V5X2lkIjoiZWQyNTUxOS0xODNkNTA4MGQxYTJlZjJiIiwibm9kZV9pZCI6InNpdGUtYS1ub2RlLTEiLCJpbnN0YWxsX2tleV9pZCI6InNpdGUtYS1ub2RlLTEuY29sbGVjdG9yLWluc3RhbGwuMSIsIm5vbmNlIjoiQUFFQ0F3UUZCZ2NJQ1FvTERBME9EdyIsImlzc3VlZF9hdCI6IjIwMjYtMTAtMjZUMTQ6NTg6MDBaIiwiZXhwaXJlc19hdCI6IjIwMjYtMTAtMjZUMTU6MDg6MDBaIiwiY3JlZGVudGlhbF9pbnN0YWxsIjp7InJlZiI6eyJpZCI6ImNyZWRfN2YzazJtOXE0eCIsImFzc2V0X2lkIjoiMmI3ZDRlMTAtOGMzZi00YTViLTllMjEtN2M0ZjBkNmE4YjEzIiwibm9kZV9pZCI6InNpdGUtYS1ub2RlLTEiLCJlbmRwb2ludF9pZCI6InBvcnQxLXRlbG5ldCIsInRyYW5zcG9ydCI6InRlbG5ldCIsInB1cnBvc2UiOiJjb2xsZWN0LXJlYWRvbmx5IiwiYWNjZXNzX2xldmVsIjoiMSIsImRvd25zdHJlYW1fc2VjdXJpdHkiOiJwbGFpbnRleHQtdW5hdXRoZW50aWNhdGVkIiwicGxhaW50ZXh0X3Njb3BlIjoibGFiLW9ubHkiLCJ2ZXJzaW9uIjoyLCJjcmVhdGVkX2J5Ijp7InR5cGUiOiJodW1hbiIsImlkIjoiYWxpY2VAc2l0ZS1hIn0sImNyZWF0ZWRfYXQiOiIyMDI2LTEwLTI0VDExOjQwOjAwWiJ9LCJzZWFsZWQiOnsiYWxnIjoieDI1NTE5LWhrZGYtc2hhMjU2LWFlczI1NmdjbSIsInJlY2lwaWVudF9rZXlfaWQiOiJzaXRlLWEtbm9kZS0xLmNvbGxlY3Rvci1pbnN0YWxsLjEiLCJlcGhlbWVyYWxfcHVibGljX2tleSI6IkJ3Y0hCd2NIQndjSEJ3Y0hCd2NIQndjSEJ3Y0hCd2NIQndjSEJ3Y0hCd2M9Iiwibm9uY2UiOiJDUWtKQ1FrSkNRa0pDUWtKIiwiY2lwaGVydGV4dCI6IkF3TURBd01EQXdNREF3TURBd01EQXdNREF3TURBd01EQXdNPSJ9fX0=",
    "signature": "BDEBVRui/EAyCDHPHDfdJLcLMbwB5WH6gc77bljcMIYaxIvxceyWIhM68N5ARSR56JOaJJ5xohfWHfJRj3FBAw=="
  }
}
