{
  "contract": "otsec.authz/0.1",
  "kind": "run",
  "request_id": "req-20261024-0002",
  "on_behalf_of": {
    "type": "schedule",
    "id": "sch-id-751-feeder-3"
  },
  "policy_version": 3,
  "run": {
    "asset_id": "2b7d4e10-8c3f-4a5b-9e21-7c4f0d6a8b13",
    "operation_id": "sel.id",
    "params": {},
    "register_version": 12
  }
}
